{
  "protocol_version": "1.0",
  "request_id": "11111111-1111-4111-8111-111111111111",
  "status": "success",
  "data": { "agent_version": "0.1.0", "state": "ready" },
  "delta": null,
  "error": null,
  "verification": "not_applicable",
  "continuation": null,
  "policy": null,
  "timing": { "duration_ms": 1 }
}
